{
  "version": 1,
  "checked_at": "2026-10-26",
  "scope": "公式公開資料・作者人物表・念能力資料・王位継承戦の主要な謎と細部の考察を横断調査。Web全件の網羅、X全投稿、DVD・図録全文、原作全話の再照合は未実施。",
  "entries": [
    {
      "id": "WEB-001",
      "title": "作者公式Xの人物表と訂正版",
      "category": "作者資料",
      "chapter": 366,
      "status": "already_recorded",
      "summary": "第9王子私設兵14人の表と、スミドリへの訂正は既に収録されている。",
      "database_comparison": "author_settingが14人にあり、設定表のみの人物は本編での顔との対応未確認として分離済み。",
      "assessment": "追加人物を重複作成しない。今回X本文の取得は403で、2026-10-09の既存一次確認を引き継ぐ。",
      "next_check": "別陣営の表を見つけた場合も、表の氏名・顔・兵種と本編の登場を別々に照合する。",
      "source_ids": [
        "togashi-x-20241217-p09",
        "togashi-x-20241217-p09-correction"
      ],
      "related_character_ids": [
        "P09",
        "P09-P05"
      ],
      "related_event_ids": [],
      "related_theory_ids": [],
      "keywords": [],
      "checked_at": "2026-10-26"
    },
    {
      "id": "WEB-002",
      "title": "ジャンプ流！の人物設定表",
      "category": "作者資料",
      "chapter": 358,
      "status": "needs_primary",
      "summary": "公式通販で第21号のDVD・冊子の存在を確認した。人物表の全文を読める公開一次画像は今回確保できていない。",
      "database_comparison": "既存の低解像度画像3枚は2026-10-09に判読保留と記録済み。",
      "assessment": "公式商品の説明は資料の所在を裏付けるが、各欄の氏名・人数・所属の証明にはならない。",
      "next_check": "DVDの人物表が映る原寸フレームで、欄の見出し・顔・氏名を組にして確認する。",
      "source_ids": [
        "web-jumpryu21-official"
      ],
      "related_character_ids": [],
      "related_event_ids": [],
      "related_theory_ids": [],
      "keywords": [
        "構想",
        "DVD",
        "設定表"
      ],
      "checked_at": "2026-10-26"
    },
    {
      "id": "WEB-003",
      "title": "ツベッパ陣営の準協会員名候補",
      "category": "作者資料",
      "chapter": 358,
      "status": "needs_primary",
      "summary": "Hunterpediaはエリックス、ムハハハサレ、ゾメーサを、第21号の人物表で名前が示されたツベッパ護衛と記載する。",
      "database_comparison": "既存の人物台帳にこの3名の登録はない。既存の第5王子側の人数枠と同じ人物かは未確認。",
      "assessment": "候補名を調査台帳へ採用。人物追加・人数枠への割当て・生存状態の登録は保留する。",
      "next_check": "第21号の該当欄でカナと準協会員の注記を直接読む。既存枠との対応が取れれば同じIDを更新する。",
      "source_ids": [
        "web-hunterpedia-erikkusu",
        "web-hunterpedia-muhahahasare",
        "web-hunterpedia-zomeesa",
        "web-jumpryu21-official"
      ],
      "related_character_ids": [
        "P05"
      ],
      "related_event_ids": [],
      "related_theory_ids": [],
      "keywords": [
        "エリックス",
        "ムハハハサレ",
        "ゾメーサ",
        "Erikkusu",
        "Muhahahasare",
        "Zomeesa"
      ],
      "checked_at": "2026-10-26"
    },
    {
      "id": "WEB-004",
      "title": "別の人物名索引にある未登録候補",
      "category": "作者資料",
      "chapter": 358,
      "status": "needs_primary",
      "summary": "海外の人物索引には、Kitokattamu・Nadaasuを第21号の資料由来とする記述がある。",
      "database_comparison": "既存の仮称人物と同一か、人数枠のどこに属するか、カナの正しい読みが未確認。",
      "assessment": "原表へ戻るための索引として保存する。索引のCanonical表記や現在地は採用しない。",
      "next_check": "DVDと照合し、原表の氏名・兵種・所属を確認する。ローマ字だけからカナを復元しない。",
      "source_ids": [
        "web-blackwhale-registry",
        "web-jumpryu21-official"
      ],
      "related_character_ids": [
        "P05"
      ],
      "related_event_ids": [],
      "related_theory_ids": [],
      "keywords": [
        "Kitokattamu",
        "Nadaasu"
      ],
      "checked_at": "2026-10-26"
    },
    {
      "id": "WEB-005",
      "title": "冨樫展の図録と念能力メモ",
      "category": "作者資料",
      "chapter": 390,
      "status": "needs_primary",
      "summary": "集英社の商品説明に、作者メモに基づく念能力解説の収録が明記されている。",
      "database_comparison": "既存調査では翻訳図から人物の属性を確定することを保留している。",
      "assessment": "資料の存在と収録内容の概要は公式確認済み。見本画像に念系統表の原図はなく、各人の系統・修練度は今回一次確認できていない。",
      "next_check": "図録の念能力資料ページを照合し、主系統・偏り・修練度・適用時点を分けて記録する。",
      "source_ids": [
        "web-puzzle-catalog-official"
      ],
      "related_character_ids": [],
      "related_event_ids": [],
      "related_theory_ids": [],
      "keywords": [
        "念系統",
        "修練度",
        "中間点",
        "構想"
      ],
      "checked_at": "2026-10-26"
    },
    {
      "id": "WEB-006",
      "title": "ハンゾーの念系統にある食い違い",
      "category": "人物・能力",
      "chapter": 372,
      "status": "needs_primary",
      "summary": "冨樫展の図録紹介では、ハンゾーを具現化系との中間にいる変化系と説明している。",
      "database_comparison": "人物データの旧登録は強化系だったが、その根拠は確認できない。",
      "assessment": "強化系の断定を外して未照合と表示する。変化系への確定変更は図録原図の確認後とする。分身の術の既存記録は保持する。",
      "next_check": "公式図録の該当座標と説明文を一次判読し、主系統と得意な技を混同しない。",
      "source_ids": [
        "web-tk-nen-midpoint",
        "web-puzzle-catalog-official"
      ],
      "related_character_ids": [
        "P12-H01"
      ],
      "related_event_ids": [
        "E372-003"
      ],
      "related_theory_ids": [],
      "keywords": [
        "ハンゾー",
        "変化系",
        "強化系"
      ],
      "checked_at": "2026-10-26"
    },
    {
      "id": "WEB-007",
      "title": "念系統の中間点と習得効率",
      "category": "人物・能力",
      "chapter": 390,
      "status": "hypothesis",
      "summary": "図録紹介の「中間点」と、習得レベル・威力精度が何％になるかという筆者の数値モデルは別の情報である。",
      "database_comparison": "既存の人物台帳には中間点の独立項目がない。",
      "assessment": "今後の項目候補として保存する。二つの系統を100％使える、という数値を人物へ追加しない。",
      "next_check": "原図の定義を確認してから主系統・位置・修練度を分ける。数値未提示の部分はnullのままとする。",
      "source_ids": [
        "web-tk-nen-midpoint",
        "web-puzzle-catalog-official"
      ],
      "related_character_ids": [],
      "related_event_ids": [],
      "related_theory_ids": [],
      "keywords": [
        "習得率",
        "威力",
        "精度",
        "中間点"
      ],
      "checked_at": "2026-10-26"
    },
    {
      "id": "WEB-008",
      "title": "フィンクスの正式能力名",
      "category": "人物・能力",
      "chapter": 377,
      "status": "confirmed_supplement",
      "summary": "公式ゲームサイト本文に、廻天（リッパー・サイクロトロン）という表記と、腕の回転によるパンチ力増大の説明がある。",
      "database_comparison": "人物・マフィア台帳は正式名の再照合待ちとして一般的な能力説明だけになっていた。",
      "assessment": "両台帳へ正式名を補足した。公式ライセンス作品による補助確認であり、原作ページの確認状態は上げない。",
      "next_check": "原作の該当ページで表記を再確認する。倍率・上限・蓄積保持時間などは補わない。",
      "source_ids": [
        "web-phinks-official-game"
      ],
      "related_character_ids": [
        "SPD-003"
      ],
      "related_event_ids": [],
      "related_theory_ids": [],
      "keywords": [
        "フィンクス",
        "廻天",
        "リッパー・サイクロトロン"
      ],
      "checked_at": "2026-10-26"
    },
    {
      "id": "WEB-009",
      "title": "廻天の追加制約という考察",
      "category": "考察",
      "chapter": 377,
      "status": "hypothesis",
      "summary": "回し終えてからの有効時間、相手の目の前で回す必要などを想定する考察がある。",
      "database_comparison": "既存台帳にこうした追加制約は登録されていない。",
      "assessment": "制約候補の比較として保存する。記事の「ありそう」は原作で示された発動条件ではない。",
      "next_check": "発動説明や失敗例が示されるまで、条件・倍率・最大威力の確定欄へ入れない。",
      "source_ids": [
        "web-phinks-realsound"
      ],
      "related_character_ids": [
        "SPD-003"
      ],
      "related_event_ids": [],
      "related_theory_ids": [],
      "keywords": [
        "回転",
        "蓄積",
        "制約"
      ],
      "checked_at": "2026-10-26"
    },
    {
      "id": "WEB-010",
      "title": "クロロの本にある文字の解読",
      "category": "人物・能力",
      "chapter": 406,
      "status": "needs_primary",
      "summary": "第406話の本の文字を「恋のダイヤル6700／いまわし電話」と読み、条件入力と番号表示による探索を説明する解読記事がある。",
      "database_comparison": "Q014とE406-006は電話の名称・元の持ち主を補完していない。今回、既存写真7の本の文字も再閲覧した。",
      "assessment": "解読候補を保存する。人名の表記が記事内でも揺れ、元画像では細かな文字に留保があるため、人物・正式能力名の確定登録はしない。",
      "next_check": "原寸の本の文字を五十音対応表と一字ずつ照合する。写真の人物を探索対象や船内の乗客と同一視しない。",
      "source_ids": [
        "web-skypenguin-406",
        "user-original-ch406"
      ],
      "related_character_ids": [
        "SPD-001"
      ],
      "related_event_ids": [
        "E406-006",
        "E406-009"
      ],
      "related_theory_ids": [
        "Q014"
      ],
      "keywords": [
        "ハンター文字",
        "6700",
        "いまわし電話",
        "マクガイド",
        "ナルミ"
      ],
      "checked_at": "2026-10-26"
    },
    {
      "id": "WEB-011",
      "title": "サイレントマジョリティーの外部犯説",
      "category": "考察",
      "chapter": 401,
      "status": "hypothesis",
      "summary": "ロンギの念使用告白から、ヒュリコフが数えた隠れ念能力者と術者の推理を再検討する記事がある。",
      "database_comparison": "Q002は視認者と術者、現場の人物と遠隔操作を区別しているが、この外部記事への参照はなかった。",
      "assessment": "比較説として採用。別の能力を持つことや協定を結ぶことだけでは、複数能力の所持・過去の犯行を完全には否定できない。",
      "next_check": "術者の独白と実際の行動を結ぶ描写で検討する。記事時点の推理を最新話の結論としない。",
      "source_ids": [
        "web-silent-anigala"
      ],
      "related_character_ids": [],
      "related_event_ids": [
        "E370-003",
        "E372-001",
        "E401-001"
      ],
      "related_theory_ids": [
        "Q002"
      ],
      "keywords": [
        "ロンギ",
        "ヒュリコフ",
        "外部犯"
      ],
      "checked_at": "2026-10-26"
    },
    {
      "id": "WEB-012",
      "title": "サイレントマジョリティーの候補比較",
      "category": "考察",
      "chapter": 403,
      "status": "hypothesis",
      "summary": "ベレレインテ・スラッカ・シェジュール・ユヒライを比較し、初期殺害の機会と人数による射程を検討する説がある。",
      "database_comparison": "初期殺害Q001と講習会暗殺Q002は既に別の問いとして管理されている。",
      "assessment": "同一犯・接触必須・射程の形・接触不能といった前提が未確定。候補名を犯人タグ・除外確定へ変換しない。",
      "next_check": "前提を一つずつ検証し、初期事件が別犯だった場合も比較する。",
      "source_ids": [
        "web-silent-may"
      ],
      "related_character_ids": [],
      "related_event_ids": [
        "E359-002",
        "E359-003",
        "E370-003",
        "E376-002"
      ],
      "related_theory_ids": [
        "Q001",
        "Q002"
      ],
      "keywords": [
        "ベレレインテ",
        "スラッカ",
        "射程"
      ],
      "checked_at": "2026-10-26"
    },
    {
      "id": "WEB-013",
      "title": "人数による発動条件と反動の説",
      "category": "考察",
      "chapter": 376,
      "status": "hypothesis",
      "summary": "宿主の周囲から人が減ると解除・反動が起きるのではないか、と読む説がある。",
      "database_comparison": "Q002では術者の在室条件・射程を未解決としている。",
      "assessment": "標的の範囲と最低人数の発動条件は別。接触必須や10人以上必要という条件を確定情報にしない。",
      "next_check": "参加者の退室、黒ぼっこの出現・解除、反動の説明をそれぞれ照合する。",
      "source_ids": [
        "web-silent-amamizu"
      ],
      "related_character_ids": [],
      "related_event_ids": [
        "E370-003",
        "E376-002"
      ],
      "related_theory_ids": [
        "Q002"
      ],
      "keywords": [
        "黒ぼっこ",
        "宿主",
        "反動",